{
  "schema_version": 1,
  "generated_at": "2026-05-09T05:42:54.492Z",
  "node_count": 15,
  "entries": [
    {
      "node_id": "node_project_youtube-algorithm-masterpiece-essence",
      "title": "유튜브 알고리즘 마스터피스의 본질",
      "node_type": "project",
      "path": "10_Wiki/Projects/Content-Systems/youtube-algorithm-masterpiece-essence.md",
      "status": "draft",
      "updated_at": "2026-04-30",
      "source_ref_count": 1,
      "summary": "유튜브 알고리즘의 모든 수학적 지표를 관통하는 단 하나의 본질은 기술적 트릭이 아닌, 시청자와의 '신뢰' 구축과 '명확한 문제 해결'에 기반한 고품질 경험의 구조화이다."
    },
    {
      "node_id": "node_skill_band-cover-ai-pipeline",
      "title": "Band Cover AI Pipeline: AI 기반 악기별 영상 프레임 선별 시스템",
      "node_type": "skill",
      "path": "10_Wiki/Skills/Development/band-cover-ai-pipeline.md",
      "status": "draft",
      "updated_at": "2026-04-16",
      "source_ref_count": 1,
      "summary": "유튜브 URL 혹은 로컬 영상을 입력받아 **yt-dlp**와 **FFmpeg**로 프레임을 추출하고, **4단계 필터링 파이프라인**과 **Gemini 2.5 Flash Vision** AI를 통해 악기별(보컬, 기타, 베이스, 피아노, 드럼) 최적의 프레임을 자동 선별하는 시스템입니다."
    },
    {
      "node_id": "node_skill_essential-elements-of-website-planning",
      "title": "웹사이트 기획 필수 요소",
      "node_type": "skill",
      "path": "10_Wiki/Skills/Development/essential-elements-of-website-planning.md",
      "status": "draft",
      "updated_at": "2026-04-17",
      "source_ref_count": 1,
      "summary": "웹사이트 개발을 시작하기 전, 프로젝트의 방향성을 정의하고 일관된 결과물을 도출하기 위해 반드시 정리해야 할 4가지 필수 구성 요소입니다."
    },
    {
      "node_id": "node_skill_untitled",
      "title": "로컬 서버 데스크톱 앱 패키징 기법",
      "node_type": "skill",
      "path": "10_Wiki/Skills/Development/local-desktop-app-packaging.md",
      "status": "draft",
      "updated_at": "2026-04-16",
      "source_ref_count": 1,
      "summary": "이 기법은 Node.js 기반의 로컬 웹 서비스를 터미널 조작 없이 바탕화면 아이콘 하나로 실행 가능하도록 데스크톱 네이티브 앱처럼 패키징하는 자동화 방법론입니다. PWA 설정, 배치 스크립트, 그리고 커스텀 아이콘 바로가기 생성을 결합하여 사용자 경험을 극대화합니다."
    },
    {
      "node_id": "node_skill_scroll-interactive-image-sequence-guide",
      "title": "스크롤 인터랙티브 이미지 시퀀스 구현 가이드",
      "node_type": "skill",
      "path": "10_Wiki/Skills/Development/scroll-interactive-image-sequence-guide.md",
      "status": "draft",
      "updated_at": "2026-04-17",
      "source_ref_count": 1,
      "summary": "Apple 스타일의 하이엔드 브랜드 경험을 제공하기 위한 스크롤 기반 이미지 시퀀스(Scrollytelling) 구현 프레임워크입니다. Next.js 14와 HTML5 Canvas를 활용하여 고해상도 프레임 애니메이션을 부드럽게 렌더링하는 기술적 구조와 디자인 전략을 포함합니다."
    },
    {
      "node_id": "node_skill_website-revision-instruction-framework",
      "title": "웹사이트 수정을 위한 3단계 지시 프레임워크",
      "node_type": "skill",
      "path": "10_Wiki/Skills/Development/website-revision-instruction-framework.md",
      "status": "draft",
      "updated_at": "2026-04-17",
      "source_ref_count": 1,
      "summary": "웹사이트 수정 요청 시 의사소통의 오류를 줄이고 정확한 결과물을 얻기 위해 '타겟-지시-키워드'로 구성된 3단계 프레임워크를 활용한다."
    },
    {
      "node_id": "node_skill_image-generation-analysis-framework",
      "title": "이미지 생성 분석 마스터 프롬프트 프레임워크",
      "node_type": "skill",
      "path": "10_Wiki/Skills/Image-Prompts/image-generation-analysis-framework.md",
      "status": "draft",
      "updated_at": "2026-04-17",
      "source_ref_count": 1,
      "summary": "이 프레임워크는 원본 이미지를 다각도(제품 상세, 카메라 구도, 환경 맥락, 조명 및 분위기)에서 체계적으로 분석하여 구조화된 JSON 데이터로 변환하기 위한 마스터 프롬프트입니다. 이는 AI 모델이 이미지의 시각적 요소를 정밀하게 이해하고 일관성 있는 이미지 생성을 위한 '프롬프트 역설계'를 가능하게 합니다."
    },
    {
      "node_id": "node_skill_infographic-generation-master-prompts",
      "title": "인포그래픽 생성 마스터 프롬프트 가이드",
      "node_type": "skill",
      "path": "10_Wiki/Skills/Image-Prompts/infographic-generation-master-prompts.md",
      "status": "draft",
      "updated_at": "2026-04-17",
      "source_ref_count": 1,
      "summary": "이 노드는 복잡한 데이터나 프로세스를 시각화하기 위한 세 가지 주요 인포그래픽 스타일(여정/마일스톤, 구조 분해, 3D 뉴모피즘)의 프롬프트 구조와 예시를 다룹니다."
    },
    {
      "node_id": "node_topic_hongsam-identity-core",
      "title": "홍삼의 자기 정의와 가치관",
      "node_type": "topic",
      "path": "10_Wiki/Topics/Identity/hongsam-identity-core.md",
      "status": "draft",
      "updated_at": "2026-04-16",
      "source_ref_count": 1,
      "summary": "나는 '홍삼'이다. ADHD라는 특성을 가지고 있으며, 이는 나에게 있어 시작의 에너지를 상징한다. 어떤 일이든 '첫 삽'을 뜰 때 그 누구보다 폭발적인 몰입도와 추진력을 발휘하는 사람이다."
    },
    {
      "node_id": "node_topic_rethinking-thinking-personality-type",
      "title": "T 성향에 대한 새로운 통찰: 생존과 배려의 관점",
      "node_type": "topic",
      "path": "10_Wiki/Topics/Journal/rethinking-thinking-personality-type.md",
      "status": "draft",
      "updated_at": "2026-04-23",
      "source_ref_count": 1,
      "summary": "사고형(T) 성향은 감정의 결여가 아니라, 현실적인 문제 해결을 통해 타인의 실질적 생존과 안녕을 돕는 또 다른 형태의 배려다."
    },
    {
      "node_id": "node_topic_wisdom-of-dialogue-transition",
      "title": "대화의 마침표를 물음표로 바꾸는 지혜",
      "node_type": "topic",
      "path": "10_Wiki/Topics/Journal/wisdom-of-dialogue-transition.md",
      "status": "draft",
      "updated_at": "2026-05-09",
      "source_ref_count": 1,
      "summary": "대화의 본질은 자신의 확신을 관철시키는 '단정'이 아니라, 상대의 세계를 존중하며 여지를 남기는 '질문'에 있다."
    },
    {
      "node_id": "node_topic_infomania-and-information-overload",
      "title": "정보과잉 시대의 인포매니아 현상과 정보 관리의 필요성",
      "node_type": "topic",
      "path": "10_Wiki/Topics/Learnings/infomania-and-information-overload.md",
      "status": "draft",
      "updated_at": "2026-05-09",
      "source_ref_count": 1,
      "summary": "무분별한 정보 수집은 지식이 아니라 강박일 뿐이며, 정보 과잉 시대에서 진정한 경쟁력은 수집이 아닌 필터링과 체계적 정리에 있다."
    },
    {
      "node_id": "node_topic_modern-definition-of-ubermensch",
      "title": "초인(Übermensch)의 현대적 정의와 실천",
      "node_type": "topic",
      "path": "10_Wiki/Topics/Learnings/modern-definition-of-ubermensch.md",
      "status": "draft",
      "updated_at": "2026-04-16",
      "source_ref_count": 1,
      "summary": "초인은 시대적 통찰을 바탕으로 자신만의 질서를 창조하고 끝까지 완수하는 능동적 실천가이다."
    },
    {
      "node_id": "node_topic_pomodoro-technique-focus",
      "title": "뽀모도로 시간 관리법을 통한 집중력 향상",
      "node_type": "topic",
      "path": "10_Wiki/Topics/Learnings/pomodoro-technique-focus.md",
      "status": "draft",
      "updated_at": "2026-05-09",
      "source_ref_count": 1,
      "summary": "집중력은 의지력의 산물이 아니라, 시간을 짧게 통제함으로써 시작의 진입장벽을 낮추는 구조적 설계에서 비롯된다."
    },
    {
      "node_id": "node_topic_power-of-small-habits",
      "title": "사소한 반복의 힘과 습관의 정의",
      "node_type": "topic",
      "path": "10_Wiki/Topics/Learnings/power-of-small-habits.md",
      "status": "draft",
      "updated_at": "2026-05-09",
      "source_ref_count": 1,
      "summary": "습관은 단순한 반복을 넘어 목적을 달성하기 위한 가장 견고한 기초이자, 자아를 형성하는 고정된 반응 양식이다."
    }
  ]
}
